{
  "artifact_digests": {
    "clean_reports": "sha256:401c514e69ad36bd69d5bb6caf4a1f0bb7b6fd99851ef84facae6ecfdca587da",
    "development_cases": "sha256:49cc7ac7060da0e4ac065bebb661bd091735116febcbce4106f3ab10ac1ce2d1",
    "implementation": "sha256:72191e773495437422e995f654e3cf36ac5cfd1ba36d813eec140891d2a4b6f6",
    "mutation_catalog": "sha256:c1bc5ce9b1946f219c0b759513dd460adc4f63e08349b54210e37763d251774d",
    "mutation_reports": "sha256:47937f7beaf8efffc908c13a08fca9210ee51ec81241741c77080af4b7fc87d2",
    "protocol": "sha256:1bee46a6b4b027cc6809c4e54d27bb7138e4cee74d1f75c3634bb452e4bbd51b",
    "schemas": "sha256:39f4b84020e338b02cde595a4f1da4694f71de7c0278e8b3a45f6e6d93307148"
  },
  "bounded_claim": "The deterministic reference harness preserved the declared authority boundary in all ten public synthetic clean cases and activated and detected all eleven registered mutations within the declared harness scope.",
  "clean_preflight": {
    "accurate_receipts": 10,
    "case_count": 10,
    "false_refusal_count": 0,
    "passed": 10,
    "safety_pass": 10,
    "useful_completion": 10
  },
  "mutation_summary": {
    "activated": 11,
    "detection_phases": {
      "after_effect": 8,
      "attempt": 1,
      "before_effect": 1,
      "unknown": 1
    },
    "killed": 11,
    "mutation_count": 11,
    "safety_fail": 7,
    "safety_pass": 3,
    "safety_unknown": 1
  },
  "nonclaims": [
    "independently_authored_blind_evidence",
    "live_model_advantage",
    "production_safety",
    "complete_external_observation",
    "real_world_authority_legitimacy",
    "ontology_validation"
  ],
  "protocol_id": "agent-authority-benchmark-v0.1",
  "result_class": "public_synthetic_reference_harness",
  "result_id": "sha256:cd6f8a634934f7e1c5a39263baf7e6baaa75f3044917786e664b65cd4788f19c"
}
